{
  "runId": "run-mu79dix0-k0fxpq",
  "projectId": "ccwd-fq",
  "flowId": "caocao-wudalang",
  "flowVersion": "1.0.0",
  "flowHash": "25568897",
  "status": "completed",
  "plan": {
    "order": [
      "m1.find-trope",
      "m1.material-dissect",
      "m2.link",
      "itb-m2.structure-design",
      "m2.structure-design",
      "m2.plot-choreographer",
      "m2.subplot-weave",
      "m2.novel-bible",
      "m2.foreshadow-plant",
      "m2.scene-breakdown",
      "m3.link",
      "itb-m3.layer-voices",
      "m3.layer-voices",
      "m3.layer-scenes",
      "m3.layer-canon",
      "m3.prose-assembler",
      "m3.novel-deai",
      "m4.link",
      "itb-m4.export-doc",
      "m4.export-doc"
    ]
  },
  "nodes": {
    "m1.find-trope": {
      "status": "done",
      "round": 1,
      "lastArtifact": "01-选题/find-trope.md",
      "stale": false
    },
    "m1.material-dissect": {
      "status": "done",
      "round": 1,
      "lastArtifact": "01-选题/material-dissect.md",
      "stale": false
    },
    "m2.structure-design": {
      "status": "done",
      "round": 3,
      "lastArtifact": "02-编剧/structure-design.md",
      "stale": false,
      "committed": []
    },
    "m2.plot-choreographer": {
      "status": "done",
      "round": 3,
      "lastArtifact": "02-编剧/plot-choreographer.md",
      "stale": false,
      "committed": []
    },
    "m2.subplot-weave": {
      "status": "done",
      "round": 3,
      "lastArtifact": "02-编剧/subplot-weave.md",
      "stale": false,
      "committed": []
    },
    "m2.novel-bible": {
      "status": "done",
      "round": 3,
      "lastArtifact": "02-编剧/novel-bible.md",
      "stale": false,
      "committed": []
    },
    "m2.foreshadow-plant": {
      "status": "done",
      "round": 3,
      "lastArtifact": "02-编剧/foreshadow-plant.md",
      "stale": false,
      "committed": []
    },
    "m2.scene-breakdown": {
      "status": "done",
      "round": 3,
      "lastArtifact": "02-编剧/scene-breakdown.md",
      "stale": false,
      "committed": []
    },
    "m2.link": {
      "status": "done",
      "round": 1,
      "verdict": "pass",
      "stale": false
    },
    "m3.layer-voices": {
      "status": "done",
      "round": 3,
      "lastArtifact": "03-写作/layer-voices.md",
      "stale": false,
      "committed": []
    },
    "m3.layer-scenes": {
      "status": "done",
      "round": 3,
      "lastArtifact": "03-写作/layer-scenes.md",
      "stale": false,
      "committed": []
    },
    "m3.layer-canon": {
      "status": "done",
      "round": 3,
      "lastArtifact": "03-写作/layer-canon.md",
      "stale": false,
      "committed": []
    },
    "m3.prose-assembler": {
      "status": "done",
      "round": 3,
      "lastArtifact": "03-写作/prose-assembler.md",
      "stale": false,
      "committed": []
    },
    "m3.novel-deai": {
      "status": "done",
      "round": 7,
      "lastArtifact": "03-写作/novel-deai.md",
      "stale": false,
      "committed": []
    },
    "m3.link": {
      "status": "done",
      "round": 3,
      "verdict": "pass",
      "stale": false,
      "committed": []
    },
    "m4.export-doc": {
      "status": "done",
      "round": 7,
      "stale": false,
      "lastArtifact": "04-交付/export-doc.docx",
      "committed": []
    },
    "m4.link": {
      "status": "done",
      "round": 7,
      "verdict": "pass",
      "stale": false,
      "committed": []
    },
    "itb-m2.structure-design": {
      "status": "done",
      "round": 1,
      "verdict": "pass",
      "stale": false
    },
    "itb-m3.layer-voices": {
      "status": "done",
      "round": 1,
      "verdict": "pass",
      "stale": false
    },
    "itb-m4.export-doc": {
      "status": "done",
      "round": 5,
      "verdict": "pass",
      "stale": false,
      "committed": []
    }
  },
  "gate": {
    "verdict": "pass",
    "node": "itb-m4.export-doc",
    "at": "2026-09-18T20:25:26.029Z",
    "note": "预授权自动审批"
  },
  "inputs": {
    "project": "ccwd-fq",
    "direction": "曹操魂穿武大郎：用兵法做炊饼、以权谋治小店；当武松推门而入时，发现弟弟已非吴下阿蒙",
    "chapters": 3,
    "route": "hot",
    "题材": "历史穿越 + 美食（快餐抽象向）",
    "需求": "曹操穿越成武大郎，从被鄙视的炊饼郎到权谋厨房之王的快餐爽文；前三章试稿",
    "灵感": "三国最强枭雄的灵魂困在北宋最卑微的躯壳里；用兵法做炊饼、以权谋待客官；当武松回家时，发现哥哥不再是那个武大郎",
    "严肃性": "探索",
    "市场预估": "历史人物穿越是验证赛道；曹操IP自带认知度与反差感（枭雄→炊饼郎）",
    "AB测试": false
  },
  "comments": {},
  "overlayHash": "ee049bfa",
  "policy": {
    "kit_boundary": "always",
    "gate_mode": "auto",
    "adapt": "propose"
  },
  "planHash": "89c9a42e",
  "lastRejectReason": ""
}
