{
  "runId": "run-mu3kjmhg-coltmb",
  "projectId": "p-fq-001",
  "flowId": "novel-fanqie",
  "flowVersion": "2.2.1",
  "flowHash": "02ea4dc8",
  "status": "suspended",
  "plan": {
    "order": [
      "market",
      "src",
      "tropes",
      "zeitgeist",
      "combo",
      "benchmark",
      "analysis",
      "gate-r1",
      "bible",
      "red-s2",
      "outline3",
      "red-s3",
      "chapter",
      "audit",
      "polish",
      "gate-final"
    ]
  },
  "nodes": {
    "src": {
      "status": "done",
      "round": 15,
      "stale": false,
      "lastArtifact": "选题素材.md"
    },
    "market": {
      "status": "done",
      "round": 13,
      "stale": false,
      "lastArtifact": "内部/kb-market.md"
    },
    "tropes": {
      "status": "done",
      "round": 15,
      "lastArtifact": "梗卡.md",
      "stale": false
    },
    "combo": {
      "status": "done",
      "round": 14,
      "stale": false,
      "lastArtifact": "内部/断言报告-combo.json"
    },
    "zeitgeist": {
      "status": "done",
      "round": 15,
      "lastArtifact": "热点素材.md",
      "stale": false
    },
    "benchmark": {
      "status": "done",
      "round": 15,
      "stale": false,
      "lastArtifact": "内部/kb-benchmark.md"
    },
    "analysis": {
      "status": "done",
      "round": 15,
      "lastArtifact": "对外交付/01-选题报告.md",
      "stale": false
    },
    "gate-r1": {
      "status": "done",
      "round": 3,
      "verdict": "pass",
      "stale": false
    },
    "bible": {
      "status": "done",
      "round": 3,
      "lastArtifact": "世界观圣经.md",
      "stale": false
    },
    "red-s2": {
      "status": "done",
      "round": 3,
      "lastArtifact": "内部/多视角意见书-S2.md",
      "stale": false
    },
    "outline3": {
      "status": "done",
      "round": 3,
      "lastArtifact": "单元剧大纲.md",
      "stale": false
    },
    "red-s3": {
      "status": "done",
      "round": 3,
      "lastArtifact": "内部/多视角意见书-S3.md",
      "stale": false
    },
    "audit": {
      "status": "done",
      "round": 5,
      "stale": false,
      "lastArtifact": "内部/断言报告-audit.json"
    },
    "polish": {
      "status": "done",
      "round": 4,
      "lastArtifact": "对外交付/02-前三章终稿.md",
      "stale": false
    },
    "gate-final": {
      "status": "awaiting",
      "round": 1,
      "stale": true
    },
    "chapter": {
      "status": "done",
      "round": 1,
      "lastArtifact": "章节正文/第3章.md",
      "stale": false
    }
  },
  "gate": {
    "verdict": "awaiting",
    "node": "gate-final",
    "round": 1,
    "token": "approval:p-fq-001:run-mu3kjmhg-coltmb:gate-final",
    "at": "2026-09-16T20:51:52.288Z",
    "note": "终稿验收（用户读三章）"
  },
  "inputs": {
    "project": "p-fq-001",
    "direction": "网文长篇连载（番茄小说平台，快餐抽象向）；从近期（近30天）大梗热梗出发选题，主打快餐抽象；前三章试稿；最终成品必须去AI味（结构级），能过番茄 AI 检测口径；快餐=章短梗密钩子狠；抽象=逻辑的意外拐弯，不是没逻辑；题材方向不限，由热梗扫描结果反向定题材（梗储量高的领域优先）",
    "platform": "番茄",
    "chapters": 3,
    "zeitgeist": true,
    "route": "hot",
    "题材": "网文长篇连载（番茄小说平台，快餐抽象向）",
    "需求": "从近期（近30天）大梗热梗出发选题，主打快餐抽象；前三章试稿；最终成品必须去AI味（结构级），能过番茄 AI 检测口径",
    "灵感": "快餐=章短梗密钩子狠；抽象=逻辑的意外拐弯，不是没逻辑；题材方向不限，由热梗扫描结果反向定题材（梗储量高的领域优先）",
    "严肃性": "探索",
    "市场预估": "番茄免费阅读大盘：前三章决定推荐池位与追读；快餐线日更2-3章需存稿；抽象梗文读者 = 学生党+年轻通勤族，对热梗脱敏快（梗生命周期2-8周），情境底座必须独立成立",
    "AB测试": false
  },
  "comments": {},
  "presets": {
    "S1": "semi",
    "S2": "auto",
    "S3": "auto",
    "S4": "semi"
  },
  "focus": "gate-final",
  "lastRejectReason": "用户流程重构指令：网文≠编剧——网文是多故事集合体（世界观串联的单元剧）。选题阶段发散性强（好梗集合：大模型/思维链/harness 素材爆炸点细化+调研融合即可），餐馆抹黑只是单元剧候选绝非主线（分清主次）；暗线先行：先搞世界观（力量体系/矛盾/力量来源，wiki 化 RAG 串联设定），大纲轻量化，成稿重心=五问（人设/冲突/梗/节目效果/AI味）。flow 已升 v2.0.0（episodic-webnovel 结构宪法 + world-forge + episodic-outline）。根因=S1 选题契约与产物结构"
}