{
  "runId": "run-mu9rbn3z-ebi7jc",
  "projectId": "p-yaomo-001",
  "flowId": "drama-flow",
  "flowVersion": "1.1.0",
  "flowHash": "3ab5655f",
  "status": "awaiting_input",
  "plan": {
    "order": [
      "m1.topic-report",
      "m1.find-trope",
      "m1.material-dissect",
      "m1.deconstruct-book",
      "m1.topic-zeitgeist",
      "m1.internet-feel",
      "m2.link",
      "itb-m2.world-forge",
      "m2.world-forge",
      "m2.structure-design",
      "m2.plot-choreographer",
      "m2.subplot-weave",
      "m2.foreshadow-plant",
      "m2.scene-breakdown",
      "m2.script-drama-beat",
      "m2.plot-redline",
      "m2.script-forge",
      "m2.novel-bible",
      "m2.episodic-outline",
      "m3.link",
      "itb-m3.scene-breakdown",
      "m3.scene-breakdown"
    ]
  },
  "nodes": {
    "m1.topic-report": {
      "status": "done",
      "round": 1,
      "lastArtifact": "01-选题/选题报告.md",
      "stale": false
    },
    "m1.find-trope": {
      "status": "done",
      "round": 1,
      "lastArtifact": "01-选题/find-trope.md",
      "stale": false
    },
    "m1.material-dissect": {
      "status": "done",
      "round": 1,
      "lastArtifact": "01-选题/material-dissect.md",
      "stale": false
    },
    "m1.deconstruct-book": {
      "status": "done",
      "round": 1,
      "lastArtifact": "01-选题/deconstruct-book.md",
      "stale": false
    },
    "m1.topic-zeitgeist": {
      "status": "done",
      "round": 1,
      "lastArtifact": "01-选题/topic-zeitgeist.md",
      "stale": false
    },
    "m1.internet-feel": {
      "status": "done",
      "round": 1,
      "lastArtifact": "01-选题/internet-feel.md",
      "stale": false
    },
    "m2.world-forge": {
      "status": "done",
      "round": 1,
      "lastArtifact": "02-编剧/world-forge.md",
      "stale": false
    },
    "m2.structure-design": {
      "status": "done",
      "round": 1,
      "lastArtifact": "02-编剧/structure-design.md",
      "stale": false
    },
    "m2.plot-choreographer": {
      "status": "done",
      "round": 1,
      "lastArtifact": "02-编剧/plot-choreographer.md",
      "stale": false
    },
    "m2.subplot-weave": {
      "status": "done",
      "round": 1,
      "lastArtifact": "02-编剧/subplot-weave.md",
      "stale": false
    },
    "m2.foreshadow-plant": {
      "status": "done",
      "round": 1,
      "lastArtifact": "02-编剧/foreshadow-plant.md",
      "stale": false
    },
    "m2.scene-breakdown": {
      "status": "done",
      "round": 1,
      "lastArtifact": "02-编剧/scene-breakdown.md",
      "stale": false
    },
    "m2.script-drama-beat": {
      "status": "done",
      "round": 1,
      "lastArtifact": "02-编剧/script-drama-beat.md",
      "stale": false
    },
    "m2.plot-redline": {
      "status": "done",
      "round": 1,
      "lastArtifact": "02-编剧/plot-redline.md",
      "stale": false
    },
    "m2.script-forge": {
      "status": "done",
      "round": 5,
      "lastArtifact": "02-编剧/剧本.md",
      "stale": false,
      "committed": []
    },
    "m2.novel-bible": {
      "status": "awaiting",
      "round": 2,
      "stale": true,
      "committed": []
    },
    "m2.episodic-outline": {
      "status": "none",
      "round": 0
    },
    "m2.link": {
      "status": "done",
      "round": 1,
      "verdict": "pass",
      "stale": false
    },
    "m3.scene-breakdown": {
      "status": "none",
      "round": 0
    },
    "m3.link": {
      "status": "none",
      "round": 0
    },
    "itb-m2.world-forge": {
      "status": "done",
      "round": 1,
      "verdict": "pass",
      "stale": false
    },
    "itb-m3.scene-breakdown": {
      "status": "none",
      "round": 0
    }
  },
  "gate": {
    "verdict": "pass",
    "node": "itb-m2.world-forge",
    "at": "2026-09-20T12:04:13.920Z",
    "note": "kit_boundary=auto 自动放行"
  },
  "inputs": {
    "project": "p-yaomo-001",
    "direction": "《那妖魔是姜大人！》（1020章玄幻爽文，主角姜月初，金手指百妖谱：击杀得道行、录妖夺神通、妖化爆发）宝刹寺线短剧改编：主线为原著 223-231 章宝刹寺正面大战至宝刹陨落，前史融入 40-46 章初遇、95-104 章戒律院冲突、124-126 章栖陀山黑山熊君；硬约束：佛门反派全部去宗教化换皮（改名、去佛词、剥离仪轨描写），保留假修行名义行恶的伪善势力戏剧功能；主角人设不违背原著底色（黑幽默、务实狠辣、恩怨分明）；交付 3 集试稿剧本，两版（原著还原版 + 短剧改编版），不要分镜",
    "episodes": 3,
    "route": "hot",
    "题材": "玄幻爽文改竖屏短剧（妖怪斩除+身份反差+打脸三段式）",
    "需求": "《那妖魔是姜大人！》宝刹寺线 3 集试稿剧本，两版交付（原著还原版 + 短剧改编版），只要剧本不要分镜；佛门反派全部去宗教化换皮",
    "灵感": "姜月初红氅归来，宝刹寺上门要交代；当年戒律院构陷之仇，今日一刀一笔清账，宝刹陨落",
    "严肃性": "标准",
    "市场预估": "中式妖怪文化+大女主复仇打脸，3 秒可懂；试稿 3 集"
  },
  "comments": {},
  "overlayHash": "fe4d64d5",
  "policy": {
    "kit_boundary": "auto",
    "gate_mode": "auto",
    "adapt": "propose"
  },
  "planHash": "a1c3fe61",
  "focus": "m2.novel-bible"
}
